{
  "$schema": "https://json-schema.org/draft/2020-12/schema",
  "$id": "https://world-puppeteer.local/schemas/profile.schema.json",
  "title": "World Puppeteer Profile",
  "type": "object",
  "required": [
    "schemaVersion",
    "id",
    "name",
    "description",
    "skills",
    "appliesTo",
    "required"
  ],
  "additionalProperties": false,
  "properties": {
    "schemaVersion": { "const": 1 },
    "id": { "type": "string", "pattern": "^[a-z0-9][a-z0-9-]*$" },
    "name": { "type": "string", "minLength": 1 },
    "description": { "type": "string", "minLength": 1 },
    "skills": {
      "type": "array",
      "items": { "type": "string", "pattern": "^[a-z0-9][a-z0-9-]*$" },
      "uniqueItems": true
    },
    "appliesTo": {
      "type": "array",
      "items": { "type": "string", "minLength": 1 },
      "uniqueItems": true
    },
    "required": { "type": "boolean" }
  }
}
