{
  "schemaVersion": 1,
  "id": "hxh-timeline",
  "name": "Hunter x Hunter Timeline",
  "description": "Initial-anchor, current-campaign-phase, spoiler-gating, and canon-divergence rules for the 287th Hunter Exam entry point.",
  "skills": [
    "hxh-timeline"
  ],
  "appliesTo": [
    "npcs",
    "locations",
    "quests",
    "story-starts",
    "world-lore",
    "ai-instructions"
  ],
  "required": true
}
